<?xml version='1.0' encoding='utf-8'?>
<cms:CuemsProjectMappings xmlns:cms="http://stagelab.net/cuems" xmlns:xsi="http://www.w3.org/2001/XMLSchema-instance" xsi:schemaLocation="http://stagelab.net/cuems /etc/cuems/project_mappings.xsd"><audio><outputs><output><name>system:playback_1</name><mappings><mapped_to>system:playback_1</mapped_to></mappings></output><output><name>system:playback_2</name><mappings><mapped_to>system:playback_2</mapped_to></mappings></output></outputs><default_output>system:playback_1</default_output><inputs><input><name>system:capture_1</name><mappings><mapped_to>system:capture_1</mapped_to></mappings></input><input><name>system:capture_2</name><mappings><mapped_to>system:capture_2</mapped_to></mappings></input></inputs><default_input>system:capture_1</default_input></audio><video><outputs><output><name>0</name><mappings><mapped_to>0</mapped_to></mappings></output><output><name>1</name><mappings><mapped_to>1</mapped_to></mappings></output></outputs><default_output>0</default_output></video><dmx /></cms:CuemsProjectMappings>