<?xml version="1.0" encoding="UTF-8"?>
<cms:CuemsProjectMappings xmlns:cms="http://stagelab.net/cuems" xmlns:xsi="http://www.w3.org/2001/XMLSchema-instance" xsi:schemaLocation="http://stagelab.net/cuems ../cuems/project_mappings.xsd">
    <audio>
        <outputs>
            <output>
                <name>system:playback_1</name>
                <mappings>
                    <mapped_to>Out1</mapped_to>
                </mappings>
            </output>
            <output>
                <name>system:playback_2</name>
                <mappings>
                    <mapped_to>Out2</mapped_to>
                </mappings>
            </output>
        </outputs>
        <default_output>system:playback_1</default_output>
    </audio>
    <video>
        <outputs>
            <output>
                <name>0</name>
                <mappings>
                    <mapped_to>VideoOut1</mapped_to>
                    <mapped_to>VideoOut3</mapped_to>
                </mappings>
            </output>
            <output>
                <name>1</name>
                <mappings>
                    <mapped_to>VideoOut2</mapped_to>
                    <mapped_to>VideoOut4</mapped_to>
                </mappings>
            </output>
        </outputs>
        <default_output>0</default_output>
    </video>
    <dmx>
    </dmx>
</cms:CuemsProjectMappings>